qid,question
3487,"Việc đình chỉ tạm thời hiệu lực Mã số kinh doanh tạm nhập, tái xuất được quy định như thế nào?"
3488,"Thủ tục cấp, cấp lại chứng chỉ hành nghề khám bệnh, chữa bệnh được quy định như thế nào ?"
3489,03 hành vi bị cấm khi sử dụng cơ sở dữ liệu hộ tịch điện tử được quy định như thế nào?
3490,Bộ Lao động - Thương binh và Xã hội có trách nhiệm gì trong hoạt động kinh doanh vận tải bằng xe ô tô?
3491,"Xin hỏi thẩm quyền tiếp nhận, thẩm định phương án ứng phó thiên tai cho công trình, vùng hạ du đập trong quá trình thi công?"
3492,"Thủ tục cấp lại giấy xác nhận đăng ký công cụ hỗ trợ đối với cơ quan, tổ chức ở địa phương ngoài phạm vi quản lý của Bộ Quốc phòng thực hiện như thế nào?"
3493,Quyết định ấn định thuế theo Nghị định 126 năm 2020 quy định như thế nào?
3494,"Theo quy định pháp luật, khi thăm viếng mộ liệt sĩ, bao nhiêu người sẽ được hỗ trợ?"
3495,Đặt cọc bao nhiêu khi tham gia đấu giá lô cổ phần kèm nợ phải thu?
3496,Người được hưởng án treo có cần thông báo tạm trú khi đến nơi khác không?
3497,Nếu chưa có Giấy chứng nhận quyền sử dụng đất thì doanh nghiệp có thể tiến hành làm hồ sơ xin cấp Giấy phép xả thải được không? Thủ tục như thế nào?
3498,"Mức phạt nếu không thực hiện quy định về việc thay đổi họ tên, địa chỉ người nhận hoặc rút lại bưu gửi được quy định như thế nào?"
3499,"Việc khiếu nại, tố cáo trong lĩnh vực cấp, quản lý, sử dụng Chứng minh nhân dân được quy định như thế nào?"
3500,"Cơ quan, tổ chức nào quản lý luồng đường thủy nội địa?"
3501,Yêu cầu về tài liệu báo cáo của tổ chức phát hành chứng khoán cơ sở để phát hành chứng chỉ lưu ký tại Sở giao dịch chứng khoán nước ngoài?
3502,Ứng xử của cha mẹ người học được quy định như thế nào?
3503,"Các trường hợp được miễn, giảm tiền DVMTR ? được quy định tại văn bản nào?"
3504,Cơ quan nào có thẩm quyền cấp giấy phép cho các hoạt động xây dựng công trình được phép xây dựng ở bãi sông nơi chưa có công trình xây dựng theo dự án đầu tư do Thủ tướng Chính phủ phê duyệt?
3505,"Pháp luật quy định như thế nào về trách nhiệm của cơ quan, người có trách nhiệm trả lời trong kết quả xử lý khiếu nại, tố cáo, kiến nghị, phản ánh ?"
3506,Chức năng của Hội đồng tư vấn chuyên môn đánh giá nguyên nhân tai biến nặng trong quá trình sử dụng vắc xin cấp tỉnh được quy định như thế nào?
3507,Thời hạn giải quyết tố cáo liên quan đến vụ việc thi hành án hình sự
3508,"Xây dựng hệ thống kết nối dự báo, cảnh báo, thông báo, báo động thông tin phòng thủ dân sự được quy định như thế nào?"
3509,"Hoạt động giám định tư pháp trong lĩnh vực nông nghiệp và phát triển nông thôn được áp dụng những quy chuẩn, tiêu chuẩn nào?"
3510,Hệ thống ACTS được hiểu thế nào?
3511,Tiêu chuẩn Bổ nhiệm chức danh Tổng biên tập cơ quan báo chí
3512,"Mức phạt đối với hành vi lấn, chiếm rừng đặc dụng có diện tích dưới 1.000 m2 được quy định như thế nào?"
3513,Phù hiệu kết hợp cấp hiệu học viên công an được quy định như thế nào?
3514,"Tôi muốn thay đổi thành viên hợp danh của Công ty hợp danh quản lý, thanh lý tài sản thì phải làm thủ tục gì?"
3515,"Hồ sơ đề nghị cấp Giấy phép mở và sử dụng tài khoản ngoại tệ ở nước ngoài để thực hiện các cam kết, thoả thuận, hợp đồng với bên nước ngoài (không bao gồm việc mở và sử dụng tài khoản ngoại tệ ở nước ngoài để thực hiện khoản vay nước ngoài theo yêu cầu của bên cho vay nước ngoài) gồm những gì?"
3516,"Trình tự thực hiện thủ tục chấp thuận thay đổi địa điểm đặt trụ sở chính của ngân hàng thương mại và sửa đổi, bổ sung Giấy phép đối với nội dung thay đổi trụ sở chính của ngân hàng thương mại như thế nào?"
3517,Hồ sơ đề nghị chấp thuận tạm ngừng hoạt động kinh doanh từ 05 ngày làm việc trở lên (trừ trường hợp tạm ngừng hoạt động do sự kiện bất khả kháng) của ngân hàng thương mại và chi nhánh ngân hàng nước ngoài gồm những gì?
3518,Đối tượng nào phải thực hiện báo cáo định kỳ của thành viên mạng lưới về hoạt động ứng cứu sự cố?
3519,"Chi tổ chức các khóa đào tạo khởi nghiệp đối với Đề án Hỗ trợ học sinh, sinh viên khởi nghiệp đến năm 2025 được quy định như thế nào?"
3520,Trưởng tàu cho tàu chạy khi chưa nhận được tín hiệu an toàn bị phạt bao nhiêu tiền?
3521,"Trường hợp cá nhân bị thu hồi chứng chỉ hành nghề, sau bao lâu thì được đề nghị cấp lại?"
3522,"Cơ quan nào là cơ quan tiếp nhận, xử lý hồ sơ đề nghị cấp phép khai thác sử dụng nước mặt, nước biển?"
3523,"Đề nghị hướng dẫn về hồ sơ phê duyệt thiết kế, dự toán công trình lâm sinh"
3524,Hồ sơ đề nghị cấp giấy phép hoạt động đo đạc và bản đồ của nhà thầu nước ngoài gồm các giấy tờ gì?
3525,"Theo quy định pháp luật, bộ phận của động vật, thực vật hoang dã nguy cấp là gì?"
3526,Làm sao để không bị xóa đăng ký thường trú khi rời khỏi địa phương lâu ngày?
3527,"Trường hợp người nộp thuế phải ngừng hoạt động do di dời cơ sở sản xuất, kinh doanh theo yêu cầu của cơ quan nhà nước có thẩm quyền làm ảnh hưởng đến kết quả sản xuất, kinh doanh được xem xét gia hạn thời hạn nộp tiền thuế, tiền chậm nộp, tiền phạt thì trong hồ sơ đề nghị gia hạn nộp tiền thuế, tiền chậm nộp, tiền phạt cần nộp những chứng từ, tài liệu gì?"
3528,Định nghĩa thu nhập từ chuyển nhượng tài sản theo Hiệp định tránh đánh thuế hai lần được quy định như thế nào?
3529,Hồ sơ đề nghị cấp Giấy chứng nhận đăng ký đầu tư ra nước ngoài đối với các dự án không thuộc diện phải có quyết định chủ trương đầu tư ra nước ngoài?
3530,"Trách nhiệm của hội đồng xác định giá bán tài sản trên đất, chuyển nhượng quyền sử dụng đất theo hình thức chỉ định được quy định như thế nào?"
3531,Có thể vừa làm giám đốc và kế toán của công ty không?
3532,Thời hạn giải quyết hồ sơ thay đổi nội dung ghi trong Giấy phép xuất bản phụ trương là bao nhiêu lâu?
3533,Vượt xe máy không đúng quy định gây tai nạn giao thông sẽ bị xử phạt thế nào?
3534,Chạy xe ô tô chuyển hướng không giảm tốc độ sẽ bị xử phạt bao nhiêu?
3535,Tôi muốn đăng ký dự kiểm tra nghiệp vụ đại diện sở hữu công nghiệp thì tôi cần phải nộp những giấy tờ gì ?
3536,"Thủ tục cấp lại giấy phép sử dụng công cụ hỗ trợ đối với cơ quan, tổ chức ở địa phương ngoài phạm vi quản lý của Bộ Quốc phòng thực hiện như thế nào?"
3537,"Mức phạt nhân viên phục vụ trên xe buýt đe dọa, xúc phạm, tranh giành, lôi kéo hành khách là bao nhiêu?"
3538,"Như thế nào được xem là sử dụng nước tiết kiệm, hiệu quả theo quy định pháp luật?"
3539,Bị phạt bao nhiêu nếu thực hòa mạng trước khi người sử dụng dịch vụ hoàn thành việc ký và thanh toán tiền mua dịch vụ viễn thông trả sau?
3540,Tố cáo và giải quyết tố cáo hành vi vi phạm pháp luật về bình đẳng giới được quy định như thế nào?
3541,Bao lâu thì bổ túc nghiệp vụ cho lực lượng bảo vệ trên tàu hỏa một lần?
3542,Đề nghị cho biết các trường hợp nào Giấy chứng nhận lưu hành thuốc thú y bị thu hồi
3543,"Tại các cơ quan, tổ chức, cơ sở thì ai có trách nhiệm tổ chức bồi dưỡng, huấn luyện nghiệp vụ về cứu nạn, cứu hộ?"
3544,"Năm 2011, bà Mai đã có giấy đồng ý (viết tay) cho con đẻ của mình làm con nuôi của anh chị Ba nhưng việc nuôi con nuôi không được đăng ký tại cơ quan có thẩm quyền. Bà Mai và anh chị Ba cùng thường trú tại xã X. Đến năm 2016, anh chị Ba mới tiến hành thủ tục đăng ký việc nuôi con nuôi. Tuy nhiên, vào thời điểm đăng ký việc nuôi con nuôi, công chức tư pháp-hộ tịch không thể lấy ý kiến đồng ý của bà Mai về việc cho con làm con nuôi vì bà Mai đi làm ăn xa, người thân trong gia đình của bà không biết bà đang ở đâu. Trong trường hợp này, có thể miễn thủ tục lấy ý kiến của bà Mai  không ?"
3545,Cơ quan báo chí khi có nhu cầu thay đổi hình thức trình bày tên gọi cơ quan báo chí có cần văn bản đề nghị của cơ quan chủ quản không?
3546,Thời hạn hủy bỏ quyết định tạm đình chỉ liên quan đến tham nhũng được quy định như thế nào?
3547,Tôi muốn dự thi lấy giấy chứng nhận khả năng chuyên môn thuyền trưởng hạng nhì hoặc máy trưởng hạng nhì thì điều kiện cần những gì?
3548,"Kê khai, thu, nộp phí tham quan Bảo tàng dân tộc Việt Nam được quy định như thế nào?"
3549,"Mức phạt khi không sửa chữa kịp thời theo quy định các biển báo hiệu nguy hiểm đã bị mất, bị hư hỏng mất tác dụng"
3550,Có gương chiếu hậu bên trái vẫn xử phạt?
3551,"Lần đầu Công ty chúng tôi đăng ký và được cấp Giấy chứng nhận đủ điều kiện hoạt động dịch vụ đánh giá/giám định công nghệ thuộc lĩnh vực quản lý nhà nước của Bộ Công Thương. Đến lần thứ hai Công ty chúng tôi đăng ký tiếp hoạt động dịch vụ đánh giá/giám định công nghệ thuộc lĩnh vực quản lý nhà nước của Bộ Y tế, vậy khi đó Công ty chúng tôi sẽ gửi hồ sơ đăng ký đến Bộ Khoa học và Công nghệ hay Bộ Y tế?"
3552,Hình thức kiểm tra và đánh giá kết quả kiểm tra về kiến thức pháp luật bán hàng đa cấp được thực hiện như thế nào?
3553,"Kính gửi Cục Quản lý chất lượng nông lâm sản và thuỷ sản, Công ty chúng tôi đã được chỉ định là cơ sở kiểm nghiệm thực phẩm vào năm ngoái. Năm nay chúng tôi dự định đăng ký thay đổi, bổ sung phạm vi chỉ định thì chúng tôi có phải thực hiện giám sát định kỳ nữa hay không?"
3554,"Đề nghị cho biết trình tự, thủ tục về khai thác tận dụng gỗ loài thực vật thông thường từ rừng tự nhiên?"
3555,Thủ tục cấp giấy phép mang vũ khí quân dụng để bảo vệ cho các đối tượng Cảnh vệ thực hiện như thế nào?
3556,"Thủ tục cấp hộ chiếu ngoại giao, hộ chiếu công vụ của công dân Việt Nam được quy định như thế nào?    "
3557,Công ty cổ phần nào không phải đăng ký công ty đại chúng với UBCKNN?
3558,"Tôi có người em bị tâm thần nhẹ, nay em tôi chuẩn bị lấy chồng. Vậy em tôi có được đăng ký kết hôn theo quy định hay không?"
3559,"Tôi đóng bảo hiểm xã hội được 19 năm 06 tháng, nay đã đủ tuổi nghỉ hưu thì có được đóng tiếp không?"
3560,Phương tiện bị người vi phạm hành chính chiếm đoạt trái phép trong lĩnh vực lâm nghiệp là gì?
3561,"Tôi có giấy phép sử dụng tần số đối với 02 trạm cố định có hạn 02 năm, tuy nhiên hiện nay do không có nhu cầu tiếp tục sử dụng nên tôi muốn dừng  hoạt động của các trạm này. Tôi muốn hỏi khi tôi dừng thì phải làm thủ tục gì và việc hoàn trả phí sử dụng tần số vô tuyến điện được quy định ra sao? Văn bản pháp luật nào quy định về vấn đề này?"
3562,"Thời gian thực hiện thủ tục cấp lại sổ đỏ cho hộ gia đình, cá nhân trong trường hợp bị mất sổ đỏ?"
3563,Mức phạt nếu trồng cây trong phạm vi đất dành cho đường bộ làm che khuất tầm nhìn
3564,Thủ tục gia hạn thời gian lưu lại lãnh thổ Việt Nam cho phương tiện vận tải thủy của Campuchia
3565,"Thống kê, lưu giữ, bảo quản, sử dụng tài liệu, vật mang bí mật nhà nước ngành tài nguyên môi trường được quy định như thế nào?"
3566,"Điều kiện về cơ sở vật chất, trang thiết bị tập luyện và thi đấu thể thao chuyên nghiệp được quy định như thế nào?"
3567,"Các cơ sở giáo dục nào phải thực hiện báo cáo, thống kê ngành giáo dục?"
3568,"Tiêu chuẩn về trình độ đào tạo, bồi dưỡng của Giáo viên tiểu học hạng III được quy định như thế nào?"
3569,"Tiêu chuẩn đối với cá nhân làm công tác liên quan trực tiếp đến bí mật nhà nước ngành văn hóa, thể thao và du lịch được quy định như thế nào?"
3570,Thời hạn xử lý đề nghị chiết khấu giấy tờ có giá theo phương thức trực tiếp mất bao nhiêu ngày?
3571,"Mức phạt khi không có quy trình quản lý, vận hành, khai thác, bảo trì đường bộ theo quy định"
3572,Mức phạt nếu điều khiển xe ô tô lắp thêm đèn
3573,"Từ năm 2020, phạm nhân dưới 18 tuổi được gặp gia đình 01 tháng bao nhiêu lần?"
3574,"Trình tự, thủ tục và hồ sơ thông báo mẫu con dấu của doanh nghiệp được thực hiện như thế nào?"
3575,"Những loài động vật hoang dã thuộc Danh mục thực vật rừng, động vật rừng nguy cấp, quý, hiếm ban hành kèm theo Nghị định số 06/2019/NĐ-CP đồng thời thuộc Danh mục loại thủy sản ban hành kèm theo Nghị định số 26/2019/NĐ-CP như: Ba ba gai, Ba ba nam bộ, Giải khổng lồ …., cơ quan nào có thẩm quyền xác nhận nguồn gốc đối với những loài này?"
3576,Công ty chúng tôi có thay đổi về tên gọi của công ty. Vậy cho chúng tôi hỏi chúng tôi có cần phải xin giấy phép hoạt động in mới không (chúng tôi đã được cấp giấy phép hoạt động in rồi)? Thủ tục đề nghị cấp giấy phép hoạt động in thế nào?
3577,Người đứng đầu cơ quan có trách nhiệm gì trong việc tiếp công dân?
3578,Nội dung chuyển nhượng quyền thăm dò khoáng sản như thế nào?
3579,"Tôi muốn khám, chữa bệnh trong thời gian tạm trú thì cần phải xuất trình những giấy tờ gì?"
3580,Thẩm quyền Đại hội đồng cổ đông trong công ty đại chúng được quy định như thế nào?
3581,"Quy định về thanh tra, kiểm tra việc cấp và thực hiện giấy phép đã được cấp đối với các hoạt động trong phạm vi bảo vệ công trình thủy lợi?"
3582,"Để được cấp phép khai thác khoáng sản, công ty chúng tôi phải đáp ứng điều kiện gì? "
3583,Thủ tục cấp giấy chứng nhận đăng ký lại phương tiện trong trường hợp chuyển từ cơ quan đăng ký khác sang cơ quan đăng ký phương tiện thủy nội địa gồm những giấy tờ gì?
3584,Giấy phép cung cấp dịch vụ chứng thực chữ ký số công cộng có thời hạn bao lâu?
3585,Bộ Giáo dục và Đào tạo có trách nhiệm như thế nào trong việc nâng chuẩn trình độ đào tạo giáo viên?
3586,Quỹ Tích lũy trả nợ chi nghiệp vụ quản lý nợ công được quy định như thế nào?
3587,Hành trình trên các hệ thống phân luồng sử dụng vùng nước phía bờ của tàu thuyền trên biển được quy định như thế nào?
3588,Cơ sở giáo dục ban hành văn bản trái thẩm quyền bị phạt bao nhiêu tiền?
3589,"Theo quy định tại Điều 17 Nghị định số 195/2013/NĐ-CP ngày 21/11/2013 của Chính phủ quy định chi tiết một số điều và biện pháp thi hành Luật Xuất bản, một trong những tiêu chuẩn về nhân lực kỹ thuật để điều hành, quản lý quá trình xuất bản xuất bản phẩm điện tử là “có phẩm chất chính trị, đạo đức tốt”. Trong hồ sơ Đề án gửi lên Cục Xuất bản, In và Phát hành, nhà xuất bản cần phải nộp tài liệu gì để chứng minh tiêu chuẩn này?"
3590,Hồ sơ đăng ký niêm yết chứng khoán tại Sở giao dịch chứng khoán nước ngoài của tổ chức phát hành Việt Nam bao gồm tài liệu gì?
3591,Mức phạt hành vi chạy xe máy gây tai nạn giao thông mà không tham gia cấp cứu người bị nạn
3592,Mật độ tập luyện môn Judo được quy định cụ thể như thế nào?
3593,"Tôi là người nước ngoài song có cơ sở sản xuất kinh doanh tại Việt Nam thì tổ chức, cá nhân nào có thể đại diện cho tôi nộp đơn đăng ký xác lập quyền SHCN?"
3594,Hồ sơ đề nghị công nhận khu du lịch quốc gia bao gồm những giấy tờ gì?
3595,"Thủ tục khi đi khám bệnh, chữa bệnh trong trường hợp đang làm thủ tục đổi thẻ BHYT như thế nào?"
3596,Thời hạn giải quyết thủ tục thu hồi giấy chứng nhận đăng ký hoạt động nhận ủy thác đầu tư gián tiếp ra nước ngoài đối với tổ chức nhận ủy thác là ngân hàng thương mại của NHNN Việt Nam là bao nhiêu ngày?
3597,Thời gian xét nâng bậc lương lần sau để trở lại bậc lương cũ trước khi bị kỷ luật được tính kể từ ngày ngày nào?
3598,"Hồ sơ đề nghị cấp bổ sung địa điểm kinh doanh mua, bán vàng miếng của đơn vị kinh doanh được cấp Giấy phép kinh doanh mua, bán vàng miếng bao gồm những gì?"
3599,"Mức phạt hành vi không bổ sung kịp thời theo quy định các biển báo hiệu nguy hiểm đã bị mất, bị hư hỏng mất tác dụng"
3600,Mức phạt hành vi chiếm dụng đất của đường bộ hoặc đất hành lang an toàn đường bộ để xây dựng nhà ở
3601,"Để chuyển nhượng quyền khai thác khoáng sản, công ty chúng tôi có phải đáp ứng điều kiện nào không?"
3602,Những người nào sẽ nhận được thông báo về thi hành án? Việc thông báo về thi hành án được thực hiện như thế nào?
3603,"Quy định về việc quản lý, bảo vệ cơ sở dữ liệu về thi hành án hình sự được quy định như thế nào?"
3604,"Tại điểm c, khoản 5, Điều 7 của Nghị định số 82/2017/NĐ-CP ngày 17/7/2017 quy định: “Trường hợp cấp nước sinh hoạt cho nhân dân ngoài phạm vi cơ sở đó thì được tính là cấp nước sinh hoạt và không phải nộp tiền cấp quyền khai thác tài nguyên nước cho phần sản lượng này”. Vậy đối với các trường hợp khai thác nước để bán nước sạch dùng trong sinh hoạt cho các hộ dân ngoài phạm vi cơ sở đó thì có phải nộp tiền cấp quyền khai thác tài nguyên nước theo Nghị định 82/2017/NĐ-CP không? Vì theo điểm b, Khoản 1, Điều 3 thì khai thác nước mặt để phục vụ hoạt động kinh doanh, dịch vụthuộc trường hợp phải nộp tiền cấp quyền khai thác tài nguyên nước."
3605,Người nào vi phạm hành chính trong kinh doanh khí bị phạt tối đa bao nhiêu tiền?
3606,"Vụ việc yêu cầu chia tài sản của tôi được Tòa án nhân dân tỉnh X xét xử sơ thẩm, sau đó tôi kháng cáo lên Tòa án nhân dân cấp cao tại thành phố Y xét xử sơ thẩm, nay đã có hiệu lực, vậy tôi phải đến cơ quan chức năng nào để yêu cầu thi hành án?"
3607,Đơn vị báo cáo và đơn vị nhận báo cáo thống kê ngành tài chính được quy định như thế nào?
3608,"Việc chào bán và niêm yết chứng khoán của công ty chứng khoán, công ty quản lý quỹ đầu tư chứng khoán tại nước ngoài quy định như thế nào?"
3609,Tôi cần chuẩn bị giấy tờ gì để thực hiện thủ tục để xin cấp phép hoạt động bến thủy nội địa?
3610,Tôi có thể đến đâu để làm thủ tục để xin cấp phép hoạt động bến thủy nội địa?
3611,"Cơ sở khám bệnh, chữa bệnh nhân đạo được cấp giấy phép hoạt động phải có những điều kiện nào?"
3612,Gửi hồ sơ giả mạo đến kho bạc nhà nước để chi cho chương trình mục tiêu quốc gia phạt bao nhiêu?
3613,Trung tâm sát hạch lái xe có trên 50% số xe sát hạch lái xe trên đường không bảo đảm điều kiện bị phạt bao nhiêu tiền?
3614,Thời gian lưu trữ hồ sơ hoàn thành công trình xây dựng thuộc dự án nhóm C tối thiểu bao nhiêu năm?
3615,Công bố danh mục khu vực nạo vét vùng nước cảng biển được quy định như thế nào?
3616,"Tôi là người phải thi hành án, tôi có yêu cầu định giá lại tài sản kê biên của tôi thì tôi phải cần những điều kiện nào? Thời hạn định giá lại tài sản kê biên bao lâu?"
3617,"Quyền miễn trừ đối với các thành viên cơ quan đại diện ngoại giao, cơ quan lãnh sự theo các Hiệp định tránh đánh thuế hai lần được quy định như thế nào?"
3618,Thời hạn giải quyết khiếu nại lần hai như thế nào?
3619,Có mấy hình thức thi tuyển phương án kiến trúc?
3620,"Hồ sơ đề nghị điều chỉnh nội dung giấy phép hoạt động đối với cơ sở khám bệnh, chữa bệnh khi thay đổi người chịu trách nhiệm chuyên môn của cơ sở khám bệnh, chữa bệnh bao gồm những giấy tờ gì ?"
3621,Doanh nghiệp đấu giá tài sản muốn thực hiện đấu giá trực tuyến thì cần đáp ứng những điều kiện gì?
3622,"Thời hạn gửi và xác nhận hoàn thành thủ tục biên phòng điện tử đối với hồ sơ điện tử sửa chữa, bổ sung trong thực hiện thủ tục biên phòng điện tử cảng biển được quy định như thế nào?"
3623,Chủ tịch UBND Quận 3 tại TP HCM là do ai bổ nhiệm?
3624,Dịch vụ karaoke là gì?
3625,"Việc đóng cảng hàng không, sân bay bao gồm các loại hình nào?"
3626,"Vợ tôi mới sinh con, nay tôi muốn đăng ký khai sinh cho con của tôi thì tôi phải đến đâu?"
3627,"Tôi bị mất GPLX, mất hết hồ sơ gốc có được cấp lại GPLX không?"
3628,Các trường hợp cấp lại giấy phép thành lập văn phòng đại diện của cơ sở giáo dục nghề nghiệp nước ngoài tại Việt Nam được quy định như thế nào?
3629,Tôi được chuyển tuyến điều trị thì cần xuất trình những giấy tờ gì?
3630,Định nghĩa phí dịch vụ kỹ thuật theo Hiệp định tránh đánh thuế hai lần được quy định như thế nào?
3631,Tôi là cán bộ tại Sở Tài chính tỉnh TN. Hiện chúng tôi đang chuẩn bị hồ sơ trình phê duyệt một dự án đầu tư xây mới Bệnh viện y học cổ truyền của tỉnh. Xin hỏi hồ sơ thẩm định khả năng trả nợ ngân sách tỉnh bao gồm những tài liệu gì?
3632,Hạng mục khắc phục hậu quả bom mìn vật nổ sau chiến tranh trong thành phần dự án đầu tư là gì?
3633,"Chúng tôi là công ty nước ngoài chưa có văn phòng đại diện hay chi nhánh tại Việt Nam. Công ty chúng tôi có thể đứng tên đăng ký lưu hành chế phẩm diệt côn trùng, diệt khuẩn dùng trong gia dụng và y tế hay không?"
3634,"Đào tạo từ xa, tự học có hướng dẫn là gì?"
3635,"Tôi muốn hỏi hồ sơ giải quyết hưởng trợ cấp một lần đối với người đang hưởng lương hưu, trợ cấp BHXH hàng tháng ra nước ngoài để định cư gồm những gì?"
3636,Thỏa thuận về bảo lãnh được quy định như thế nào?
