qid,question
1782,"Nguồn vốn hỗ trợ phát triển thủy lợi nhỏ, thủy lợi nội đồng và tưới tiên tiến, tiết kiệm nước được quy định như thế nào?"
1783,"Công ty chúng tôi đầu tư sang Lào và có đưa lao động sang dự án làm việc, xin hỏi chúng tôi phải làm thủ tục gì để đưa những lao động này sang Lào?"
1784,Những đơn vị nào có thể đề nghị cấp Giấy chứng nhận đủ điều kiện xét nghiệm khẳng định các trường hợp HIV dương tính?
1785,"Thủ tục cấp giấy phép sửa chữa vũ khí thô sơ đối với cơ quan, tổ chức ở địa phương không thuộc phạm vi quản lý của Bộ Quốc phòng thực hiện như thế nào?"
1786,Không có chứng chỉ nghiệp vụ sư phạm có được dạy ở trung tâm ngoại ngữ không?
1787,Tỷ lệ lấp đầy của khu công nghiệp là gì?
1788,Nhiệm vụ của người thực hiện hoạt động xét nghiệm tại trạm y tế xã được quy định như thế nào?
1789,Cơ quan nào có thẩm quyền điều chỉnh giấy phép kinh doanh vũ trường?
1790,Cơ quan nào chị trách nhiệm kiểm tra nội dung báo chí nhập khẩu trước khi phát hành?
1791,Quyền hạn của Bộ Công an đối với dữ liệu thi hành án hình sự?
1792,Phạm tội nhiều nơi thì tòa án nào có thẩm quyền giải quyết?
1793,Sau bao lâu kể từ khi nộp hồ sơ kiểm định phương tiện PCCC và CNCH thì nhận được kết quả?
1794,Ai được hưởng mức hỗ trợ cung cấp dịch vụ viễn thông công ích khẩn cấp được quy định như thế nào?
1795,"Hồ sơ đề nghị chấp thuận gia hạn trực tiếp nhận và chi, trả ngoại tệ của tổ chức kinh tế gồm những gì?"
1796,Hồ sơ đề nghị cấp lại văn bản xác nhận thông báo hoạt động bưu chính khi bị mất hoặc hư hỏng không sử dụng được gồm những loại tài liệu nào?
1797,"Việc xác định tiền lương, tiền thưởng tại tổng công ty nhà nước phải loại trừ yếu tố khách quan nào?"
1798,Trách nhiệm của UBND cấp xã khi nhận được khiếu nại do Ủy ban Mặt trận tổ quốc Việt Nam và các tổ chức thành viên chuyển đến?
1799,"Theo quy định hiện hành thì việc ban hành kế hoạch kiểm tra về phòng cháy, chữa cháy và cứu nạn, cứu hộ quy định ra sao?"
1800,Tổ chức hỗ trợ khởi nghiệp đổi mới sáng tạo là tổ chức nào?
1801,"Công ty chúng tôi muốn thay đổi phương pháp khai thác, công nghệ khai thác, tôi phải làm hồ sơ như thế nảo?"
1802,"Tôi muốn hỏi thời hạn giải quyết hồ sơ hoàn trả tiền đã đóng đối với người tham gia bảo hiểm y tế theo hộ gia đình, người tham gia bảo hiểm y tế được ngân sách nhà nước hỗ trợ một phần mức đóng?"
1803,Cơ quan nào có thẩm quyền tiếp nhận hồ sơ đề nghị công nhận khu du lịch cấp tỉnh?
1804,Thành phần hồ sơ đề nghị điều chỉnh giấy phép hoạt động xây dựng bao gồm những tài liệu nào?
1805,"Trả kết quả xét nghiệm việc thực hiện xét nghiệm trong khám bệnh, chữa bệnh được quy định như thế nào?"
1806,Công dân có tỉnh giáp biên giới với Campuchia có được cấp giấy thông hành không?
1807,"Thành phần hồ sơ cấp lại Giấy chứng nhận đủ điều kiện hoạt động kiểm định kỹ thuật an toàn lao động trong trường hợp bổ sung, sửa đổi Giấy chứng nhận được quy định tại văn bản nào?"
1808,Hợp đồng làm việc của viên chức là gì?
1809,"Thương binh vi phạm pháp luật, tháng 12/2013 bị Tòa án tuyên bố phạt tù 6 năm vì tội lừa đảo, chiếm đoạt tài sản, đã chấp hành xong hình phạt tù năm 2018, có được hưởng lại chế độ thương binh không? Thủ tục như thế nào "
1810,"Tài xế ô tô chở hàng nguy hiểm dừng xe, đỗ xe ở khu dân cư có bị tước bằng lái?"
1811,Chữ ký số là gì?
1812,"Tôi hiện đang sở hữu vũ khí thô sơ dùng làm hiện vật để trưng bày, cho tôi hỏi thủ tục khai báo vũ khí thô sơ đối với trường hợp này như thế nào?"
1813,"Tổ chức tự doanh là ngân hàng thương mại, công ty tài chính tổng hợp khi có nhu cầu cấp giấy chứng nhận đăng ký đầu tư gián tiếp ra nước ngoài có thể nộp hồ sơ bằng cách nào?"
1814,Thanh toán dự án BT bằng quỹ đất đã giải phóng mặt bằng theo tiến độ có phải ký kết phụ lục không?
1815,Hướng nghiệp và phân luồng trong giáo dục từ tháng 7/2020 được quy định như thế nào?
1816,"Văn bản xác nhận là chuyên gia như thế nào được coi là phù hợp với quy định, có yêu cầu phải có kinh nghiệm kèm theo không?"
1817,Tôi đã đăng kí kết hôn với người nước ngoài và hiện đang làm giấy tờ xin định cư tại nước ngoài. Tôi vẫn thường xuyên về Việt Nam. Như thế có phải xin đăng kí giữ quốc tịch Việt Nam không và có phải khai báo với công an địa phương ở Việt Nam?
1818,Trường hợp nào được cấp giấy xác nhận phù hợp về tuyển dụng và cung ứng thuyền viên hàng hải?
1819,Thời hạn Ngân hàng Nhà nước  thực hiện việc xử lý hồ sơ cấp mã Bin cho các tổ chức phát hành thẻ là bao nhiêu lâu?
1820,"Hồ sơ đề nghị chấp thuận danh sách dự kiến nhân sự của tổ chức tín dụng, chi nhánh ngân hàng nước ngoài phải được lập theo nguyên tắc như thế nào?"
1821,"Em là điều dưỡng đang làm việc tại TP.Hà Nội nhưng hộ khẩu ở tỉnh Tuyên Quang. Bây giờ, em muốn đăng ký cấp chứng chỉ hành nghề ở TP.Hà Nội có được không?"
1822,"Điều kiện tham gia hoạt động điều tra, khảo sát, rà phá bom mìn vật nổ sau chiến tranh theo quy định hiện hành"
1823,Hồ sơ đề nghị chấp thuận thay đổi chỉ đặt trụ sở chính không phát sinh thay đổi địa điểm đặt trụ sở chính của tổ chức tín dụng phi ngân hàng gồm những gì?
1824,Đóng dấu chữ ký khắc sẵn trên chứng từ kế toán được không?
1825,Điều kiện để lắp đặt công trình thiết yếu vào công trình cầu là gì?
1826,Các ngành đúng đào tạo về công nghệ thông tin gồm ngành gì?
1827,"Hiện nay Công ty X có ba trạm giảm áp khí thiên nhiên, trong đó có 02 trạm sử dụng bồn cố định để chứ khí và o1 trạm sử dụng bồn chứ di động để cấp khí thiên nhiên cho khách hàng. Tại khoản 9 Điều 3 Nghị định số 87/2018/NĐ-CP ngày 15 tháng 6 năm 2018 của Chính phủ về kinh doanh khí định nghĩa: “Trạm cấp khí là trạm sử dụng phương tiện, thiết bị chuyên dụng để cấp khí từ bồn chứu cố định hoạc hệ thống dàn chai LPG trực tiếp qua đường ống dẫn đến nơi sử dụng”. Như vậy Công ty X có phải xây dụng các tài liệu quản lý an toàn trình Bộ Công Thương chấp thuận không?"
1828,"Mức phạt đối với hành vi tổ chức du lịch, tham quan trong rừng mà không được phép của chủ rừng được quy định như thế nào?"
1829,"Khi xảy ra sự cố, tai nạn giao thông đường sắt đô thị thì có thể báo tin bằng những biện pháp nào?"
1830,"Thời hạn giải quyết thủ tục chấp thuận gia hạn thời hạn hoạt động và sửa đổi, bổ sung Giấy phép đối với nội dung gia hạn thời hạn hoạt động của chi nhánh ngân hàng nước ngoài là bao lâu?"
1831,Ủy ban nhân dân cấp tỉnh có được phân cấp cho Ban quản lý khu kinh tế cấp giấy phép xây dựng hay không?
1832,"Cài đặt, sao lưu và phục hồi dữ liệu trợ giúp xã hội và giảm nghèo được quy định như thế nào?"
1833,Mức phạt khi nằm trên yên xe điều khiển xe máy mà không chấp hành hiệu lệnh dừng xe được quy định như thế nào?
1834,"Thẩm quyền, trình tự, thủ tục công nhận tuổi nghề cơ yếu như thế nào?"
1835,Xử lý vi phạm đối với người chấp hành án phạt cải tạo không giam giữ
1836,Tổ chức hội nghị đối thoại giữa Chủ tịch quận với Nhân dân ở TP HCM được quy định như thế nào?
1837,Triển khai hoạt động khu CNTT tập trung không đáp ứng tiêu chí của khu CNTT tập trung bị phạt bao nhiêu tiền?
1838,"Xác nhận thời gian thực hành đối với bác sỹ, y sỹ, hộ sinh viên, điều dưỡng viên, kỹ thuật viên trước khi được cấp chứng chỉ hành nghề được quy định như thế nào?"
1839,"Xin hỏi cơ quan phê duyệt, công bố công khai quy trình vận hành hồ chứa nước loại quan trọng đặc biệt, lớn, vừa?"
1840,"Công ty tôi đang thi công gói thầu ""cung cấp và lắp đặt hệ nhôm kính, cửa kính, vách kính"" cho các tòa cao tầng nhưng hiện nay khi tham gia đấu thầu dự án mới chủ đầu tư yêu cầu phải có chứng chỉ năng lực hoạt động xây dựng. Qua tìm hiểu các nghị định, thông tư liên quan thì không thấy có nhắc đến lĩnh vực công ty tôi đang tham gia. Vậy tôi xin hỏi, công ty tôi có phải làm chứng chỉ năng lực hoạt động xây dựng trên không? Và nếu có thì sẽ thuộc lĩnh vực nào?"
1841,Hồ sơ hưởng trợ cấp tử tuất đối với người chỉ có thời gian đóng BHXH tự nguyện bị chết được quy định như thế nào?
1842,"Thời hạn của văn bản thỏa thuận thông số kỹ thuật xây dựng bến khách ngang sông, bến thủy nội địa phục vụ thi công công trình chính là bao lâu?"
1843,Bao lâu thì được thanh toán BHXH 1 lần ?
1844,"Tôi có công trình xây dựng không theo tuyến cấp đặc biệt, vậy đề nghị Bộ Xây dựng hướng dẫn tôi thành phần hồ sơ đề nghị cấp giấy phép xây dựng theo giai đoạn bao gồm những tài liệu gì?"
1845,Giấy tờ xác định nguồn gốc xe máy chuyên dùng được quy định như thế nào?
1846,Đề nghị làm rõ việc đánh dấu mẫu vật bằng “vật liệu khác” quy định tại khoản 2 Điều 34 Thông tư số 27/2018/TT-BNNPTNT là gì?
1847,"Công ty chúng tôi muốn đề nghị cấp giấy phép thăm dò khoáng sản, chúng tôi phải nộp hồ sơ ở đâu?"
1848,"Khiếu nại lần 02, thời hạn giải quyết tối đa là bao nhiêu ngày?"
1849,Điều kiện Văn phòng công chứng tự chấm dứt hoạt động?
1850,Mức phạt khi thi công trên đường bộ đang khai thác không treo biển báo thông tin công trình
1851,Giá trị của Giấy xác nhận tình trạng hôn nhân kéo dài trong bao lâu?
1852,Phí thẩm định cấp giấy phép sử dụng VLNCN được quy định như thế nào?
1853,Đỗ xe ô tô không sát mép đường phía bên phải theo chiều đi ở nơi đường có lề đường hẹp sẽ bị xử phạt bao nhiêu?
1854,Tôi muốn đề nghị Bộ Tư pháp cấp Giấy phép thành lập Trung tâm Trọng tài thì cần thực hiện thủ tục gì?
1855,Thời gian nộp phí quản lý công ty đại chúng là khi nào?
1856,Hồ sơ đề nghị gia hạn Giấy phép quá cảnh hàng hóa thuộc danh mục cấm của Việt Nam nhưng không thuộc danh mục cấm của Campuchia qua lãnh thổ Việt Nam bao gồm những giấy tờ gì?
1857,"Tôi ở khu vực miền Trung, muốn đăng ký biện pháp bảo đảm đối với tài sản là ô tô thì đăng ký ở đâu? Việc đăng ký biện pháp bảo đảm bằng tài sản nói trên có phân chia theo địa giới hành chính không?"
1858,Khi nào cần gia hạn hoạt động của kết cấu hạ tầng cảng biển tạm thời?
1859,Kết hôn với người chưa đủ tuổi thì bị phạt bao nhiêu tiền?
1860,Trình tự thực hiện thủ tục đăng ký danh hiệu thi đua đối với các tổ chức tài chính vi mô như thế nào?
1861,Chế độ hiện đại hóa trong công tác quản lý hồ sơ viên chức được quy định như thế nào?
1862,"Trong 01 năm tập thể, cá nhân có được đề nghị khen thưởng Bằng khen của Thống đốc và Bằng khen của Thủ tướng Chính phủ không?"
1863,Thời gian thẩm định hồ sơ cho hưởng miễn trừ của Cơ quan quản lý cạnh tranh là bao lâu
1864,Hồ sơ đề nghị cấp giấy phép vận chuyển vũ khí thể thao như thế nào?
1865,Cơ quan công an kết luận hồ sơ đăng ký thành lập Công ty TNHH HM có yếu tố giả mạo. Xin hỏi trong hợp này doanh nghiệp sẽ bị xử lý như thế nào?
1866,Đề nghị cho biết các trường hợp nào giấy phép khảo nghiệm bị thu hồi
1867,Muốn gặp bị can mà chỉ xuất trình thẻ Luật sư là chưa đủ được quy định như thế nào?
1868,"Sau khi đã công bố sản phẩm, tổ chức cá nhân muốn sửa chữa hoặc đính chính hoặc thay đổi một số nội dung như tên sản phẩm, thành phần cấu tạo thì có phải thông báo với quan quản tiếp nhận hồ sơ không."
1869,"Tôi là giám đốc doanh nghiệp, thường xuyên phải đi công tác. Tôi muốn ký trước vào các hợp đồng tại các tổ chức hành nghề công chứng được không?"
1870,Cơ quan nhà nước xử lý đối với tố cáo quá thời hạn mà chưa được giải quyết như thế nào?
1871,Yêu cầu đối với cuộc gọi điện thoại quảng cáo như thế nào?
1872,"Thủ tục Phê duyệt bổ sung danh mục kỹ thuật của các cơ sở khám bệnh, chữa bệnh thuộc thẩm quyền quản lý của Bộ Y tế?"
1873,Hồ sơ điều chỉnh giấy phép của cơ sở KCB thuộc BQP khi thay đổi quy mô được quy định như thế nào?
1874,Người lập di chúc được thay đổi việc lập di chúc bao nhiêu lần?
1875,"Trong trường hợp nào thì doanh nghiệp cần sửa đổi, bổ sung Giấy phép kinh doanh sản phẩm, dịch vụ an toàn thông tin mạng?"
1876,"Cơ quan có quyền giám sát, kiểm tra việc thực hiện Dự án sân gôn?"
1877,Cơ quan nào có thẩm quyền cấp  giấy phép đối với các hoạt động liên quan đến đê điều?
1878,Thành lập ban tổ chức giải thể thao quần chúng được quy định như thế nào?
1879,Thẩm quyền công khai tài sản công của các đơn vị thuộc Bộ Quốc phòng được quy định như thế nào?
1880,Khi nào thì chủ đầu tư được thuê tư vấn quản lý dự án và điều kiện năng lực tư vấn quản lý dự án? Nếu được làm tư vấn quản lý dự án mà chưa đủ năng lực thì có được liên danh tư vấn quản lý dự án với một công ty khác đủ năng lực không?
1881,Thẩm quyền giải quyết khiếu nại của Chủ tịch Ủy ban nhân dân cấp huyện?
1882,Thời gian xử lý hồ sơ cấp Giấy phép mở và sử dụng tài khoản ngoại tệ ở nước ngoài của các doanh nghiệp thuộc diện đầu tư đặc biệt quan trọng theo chương trình của Chính phủ; doanh nghiệp đầu tư dưới hình thức đối tác công tư (PPP) mở tài khoản để thực hiện các cam kết với bên nước ngoài của NHNN là bao nhiêu ngày?
1883,Doanh nghiệp muốn nhập khẩu trang thiết bị y tế để đánh giá chất lượng trước khi nhập khẩu thương mại nên phải xin phép nhập khẩu. Vậy trường hợp này có thuộc điểm nào của khoản 1 Điều 42 Nghị định 36/2016/NĐ-CP và Nghị định 169/2018/NĐ-CP không?
1884,Khi nào người giải quyết tố cáo quyết định việc trưng cầu giám định?
1885,"Trường hợp nhà đầu tư muốn điều chỉnh báo cáo nghiên cứu khả thi thì thủ tục thẩm định, phê duyệt báo cáo nghiên cứu khả thi điều chỉnh thực hiện như thế nào?"
1886,Thông báo tìm kiếm việc làm theo Điều 52 của Luật việc làm là như thế nào?
1887,Người phụ trách kinh doanh dịch vụ lữ hành phải giữ những chức danh gì trong doanh nghiệp?
1888,"Khi thực hiện việc khiếu nại, người khiếu nại có những quyền, nghĩa vụ gì?"
1889,"Thủ tục, trình tự tuyển lao động như thế nào?"
1890,Những hợp đồng nào được xem là hợp đồng bảo đảm?
1891,Trách nhiệm của chủ đầu tư hoặc chủ dự án đối với nhà thầu nước ngoài khi thực hiện công việc tại Việt Nam như thế nào?
1892,"Tổ chức, cá nhân có quyền và nghĩa vụ gì khi quản lý điểm du lịch?"
1893,"Những chính sách đối với cơ quan, tổ chức, đơn vị tổ chức hoạt động tình nguyện vì cộng đồng, xã hội được quy định như thế nào?"
1894,Tôi có thể đề nghị cấp Sổ thuyền viên ở đâu?
1895,Quốc hội quyết định chủ trương đầu tư đối với loại dự án nào do nhà đầu tư đề xuất?
1896,"Hồ sơ đề nghị công bố mở luồng, tuyến đường thuỷ nội địa (ĐTNĐ) chuyên dùng nối với ĐTNĐ quốc gia, ĐTNĐ chuyên dùng nằm trên địa giới hai tỉnh, thành phố trực thuộc Trung ương trở lên hoặc ĐTNĐ chuyên dùng nối ĐTNĐ quốc gia với ĐTNĐ địa phương đối với luồng, tuyến ĐTNĐ mới có dự án đầu tư xây dựng, gồm những gì?"
1897,"Hồ sơ xin ý kiến dự án đầu tư xây dựng công trình âu tàu, đập, thuỷ điện, thuỷ lợi, công trình thuỷ điện, thuỷ lợi kết hợp giao thông liên quan đến đường thuỷ nội địa cần những gì?"
1898,Trách nhiệm của Cơ quan ngang Bộ trong việc quản lý nhà nước về huy động lực lượng dự bị động viên?
1899,Nghĩa vụ của đại lý chào mua cổ phiếu công khai được quy định như thế nào?
1900,"Thủ tục cấp giấy phép vận chuyển công cụ hỗ trợ đối với cơ quan, tổ chức ở trung ương không thuộc phạm vi quản lý của Bộ Quốc phòng thực hiện như thế nào?"
1901,"Không trả lời tin nhắn, nhà mạng thu tiền dịch vụ có đúng không?"
1902,Báo cáo về hoạt động quy hoạch năng lượng nguyên tử được quy định như thế nào?
1903,"Đề nghị cho biết Trưởng Ban tiếp công dân có nhiệm vụ, quyền hạn gì? Trưởng Ban tiếp công dân có giải quyết kiến nghị của công dân không"
1904,Chúng tôi cần xuất trình những giấy tờ gì khi làm thủ tục cho phương tiện thủy nội địa vào cảng biển?
1905,"Xác định, đóng dấu độ mật đối với tài liệu bí mật nhà nước ngành tài nguyên môi trường được quy định như thế nào?"
1906,Các hình thức kỷ luật mà Đại đội trưởng được áp dụng đối với người vi phạm?
1907,Hành vi điều khiển xe máy mà vượt đèn đỏ sẽ bị xử phạt bao nhiêu?
1908,Đối tượng được bổ nhiệm Thủ trưởng cơ quan quản lý thi hành án hình sự thuộc Bộ Công an được quy định như thế nào?
1909,"Kiểm tra nhà nước về chất lượng sản phẩm, hàng hóa có khả năng gây mất an toàn thuộc trách nhiệm quản lý của BLĐTBXH được quy định như thế nào?"
1910,Mức xử phạt khi điều khiển xe ô tô đi qua dải phân cách cố định ở giữa hai phần đường xe chạy
1911,"Xác định người bị kiện sau khi thực hiện sáp nhập, hợp nhất địa giới hành chính được quy định như thế nào?"
1912,"Xử lý vi phạm hành chính về an toàn thực phẩm đối với sản xuất, kinh doanh, sử dụng phụ gia thực phẩm được quy định như thế nào?"
1913,Cờ hiệu ưu tiên của xe Công an làm nhiệm vụ khẩn cấp được quy định như thế nào?
1914,"Đơn vị đo kiểm thiết bị viễn thông, đài vô tuyến điện được quy định như thế nào?"
1915,Giải thể quỹ đầu tư chứng khoán được quy định như thế nào?
1916,Điều kiện để tổ chức tín dụng được lựa chọn làm cơ quan cho vay lại chịu rủi ro tín dụng là như thế nào?
1917,"Hợp đồng, giao dịch bằng tiếng nước ngoài có được chứng thực không?"
1918,Mỗi tòa án được ký hợp đồng dịch vụ tống đạt với bao nhiêu Văn phòng Thừa phát lại?
1919,Thời hạn tạm thời chuyển vị trí công tác đối với người có chức vụ theo pháp luật tham nhũng?
1920,Nộp Hồ sơ Kê khai giá thuốc ở đâu?
1921,Ủy ban xã có được điều chỉnh dự toán thu chi hằng năm đã được duyệt không?
1922,"Hồ sơ cấp Giấy phép sửa đổi, bổ sung những nội dung ghi trong Giấy phép xuất bản thêm ấn phẩm báo chí quy định ở đâu?"
1923,Các trường hợp thu hồi quyết định cho phép thành lập Văn phòng công chứng?
1924,Tôi muốn chuyển nhượng đơn đăng ký kiểu dáng công nghiệp thì tôi cần nộp những tài liệu gì?
1925,Thành phần hồ sơ đề nghị tham gia đấu giá quyền khai thác khoáng sản bao gồm những tài liệu nào? bao nhiêu bộ hồ sơ?
1926,"Công ty chúng tôi đang thực hiện thủ tục để chứng nhận cho kiểu loại xe đạp điện. Chúng tôi hiểu là sẽ nhận được Giấy chứng nhận sau 03 ngày kể từ ngày được tiếp nhận hồ sơ theo quy định. Vậy, cách hiểu của chúng tôi có đúng không? Nếu không thì thời gian quy định như thế nào?"
1927,Chúng tôi muốn đăng ký làm nhà tạo lập thị trường thì cần phải nộp những hồ sơ gì?
1928,Thời gian cấp giấy phép xây dựng là bao lâu?
1929,Thời gian để Ngân hàng Nhà nước có quyết định sửa đổi thời hạn hoạt động của ngân hàng thương mại  tại Giấy phép là bao lâu?
1930,"Những trường hợp nào, tổ chức cá nhân hoạt động viễn thông được miễn giấy phép viễn thông?"
1931,"Người sử dụng lao động tham gia bảo hiểm tai nạn lao động, bệnh nghề nghiệp bao gồm những đối tượng nào?"
1932,Công an xã xử phạt lỗi không mang bằng lái xe có đúng không?
1933,Các trường hợp cách chức đối với công chức trong việc xử lý VPHC được quy định như thế nào?
1934,"Tôi muốn biết doanh nghiệp, tổ chức nước ngoài có cơ sở sản xuất kinh doanh tại Việt Nam thì tổ chức, cá nhân nào có thể đại diện nộp đơn đăng ký xác lập quyền SHCN?"
1935,Một nhiệm kỳ một người được ứng cử bao nhiêu cấp đại biểu HĐND?
1936,Thời hạn cấp Giấy phép thành lập cho Văn phòng đại diện là bao lâu?
1937,"Trình tự, thủ tục thu thập, cập nhật, chỉnh sửa thông tin trong Cơ sở dữ liệu căn cước công dân cụ thể như thế nào?"
1938,"Mức phạt khi tự ý xây dựng hoặc thành lập bến xe, bãi đỗ xe, trạm dừng nghỉ, trạm thu phí đường bộ"
1939,"Thẩm quyền phê duyệt quy trình vận hành hồ chứa của Bộ Công Thương, cơ quan nào tiếp nhận hồ sơ trình thẩm định quy trình vận hành hồ chứa thuộc thẩm quyển của Bộ Công Thương? "
1940,Trinh sát tuần thám trên không quân sự cấp 2 máy bay vận tải phải tích lũy bao nhiêu giờ bay?
1941,"Hồ sơ trình thẩm định thiết kế BVTC, dự toán xây dựng công trình gồm những tài liệu, văn bản gì?"
1942,"Tư vấn xác định đề tài, dự án sản xuất thử nghiệm cấp Bộ Y tế là gì?"
1943,Tôi muốn hỏi hồ sơ để cấp giấy phép kinh doanh chuyển khẩu gồm những gì?
1944,Sở Tư pháp tỉnh A nhận được đề nghị của bà Trần Thị B về việc thực hiện thủ tục thay đổi nơi tập sự hành nghề công chứng sang tổ chức hành nghề công chứng khác trong cùng tỉnh vì lý do bà thay đổi nơi làm việc. Đề nghị của bà Trần Thị B có được chấp nhận không?
1945,Công ty ký hợp đồng lao động 5 tháng với người nước ngoài thì có phải đóng BHXH cho họ không?
1946,Điều khiển xe máy từ 02 xe trở lên chạy quá tốc độ mà không chấp hành hiệu lệnh dừng xe sẽ bị xử phạt bao nhiêu?
