qid,question
5088,"Có nồng độ cồn chưa vượt 0,25 miligam/1 lít khí thở điều khiển xe ô tô phạt bao nhiêu?"
5089,Chế độ đối với người điều khiển phương tiện kỹ thuật dự bị trong thời gian được huy động
5090,Ủy quyền lại có cần sự đồng ý của bên ủy quyền không?
5091,"Bố tôi là liệt sĩ, tôi có 5 anh chị em ruột, tôi hiện đang hưởng trợ cấp tiền tuất hàng tháng đối với con liệt sĩ. Tôi muốn hưởng trợ cấp thờ cúng liệt sĩ là bố tôi, tôi cần thực hiện thủ tục nào?"
5092,"Theo quy định pháp luật, mục đích của việc đào tạo, bồi dưỡng nghiệp vụ chuyên ngành thẩm định giá là gì?"
5093,"Giấy phép KDVCHK, kinh doanh hàng không chung được cấp lại trong những trường hợp nào?"
5094,Thế nào là hình thức kế toán theo quy định cũ?
5095,Thời hạn nộp tiền sử dụng đất là khi nào?
5096,Người nhận cầm cố có được cho thuê tài sản cầm cố không?
5097,Quản lý sinh vật gây hại thuộc danh mục đối tượng phải kiểm soát và danh mục đối tượng kiểm dịch thực vật nhóm II được quy định như thế nào?
5098,"Công ty tôi đã được cấp giấy chứng nhận đủ điều kiện hoạt động huấn luyện an toàn, vệ sinh lao động hạng C. Nay tôi  muốn thực hiện việc bổ sung phạm vi huấn luyện an toàn, vệ sinh lao động thì tôi sẽ phải nộp hồ sơ cho cơ quan nào để thực hiện việc cấp  giấy chứng nhận huấn luyện bổ sung phạm vi huấn luyện?"
5099,Hệ thống đấu thầu quốc gia có địa chỉ như thế nào?
5100,"Tôi là một công dân Việt Nam, làm việc tự do, tôi có quyền phản ánh, kiến nghị về sự không cần thiết, tính không hợp lý, không hợp pháp của thủ tục hành chính hoặc bất cập trong giải quyết thủ tục hành chính không?"
5101,Những đối tượng nào được cấp giấy thông hành tại vùng biên giới Việt Nam - Trung Quốc?
5102,Xử lý cơ sở sản xuất tự ý tẩy xóa Giấy chứng nhận đủ điều kiện sản xuất hóa chất sản xuất có điều kiện trong lĩnh vực công nghiệp được quy định như thế nào?
5103,Chi phí điều chỉnh đồ án quy hoạch được xác định như thế nào?
5104,"Tôi có thời gian tham gia bảo hiểm xã hội là 15 năm 1 tháng. Vừa rồi cơ quan tôi tổ chức khám sức khỏe cho cán bộ nhân viên, phát hiện tôi bị mắc bệnh ung thư. Tôi đã đến bệnh viện uy tín kiểm tra lại bác sĩ ghi trong hồ sơ bệnh án tôi bị ung thư giai đoạn cuối. Tôi muốn hưởng bảo hiểm xã hội một lần để cho đỡ thiệt thòi có được không?"
5105,Làm sao để phân biệt nơi thường trú và nơi tạm trú?
5106,"Công ty chúng tôi muốn tăng công suất khai thác, tôi phải nộp hồ sơ gồm những giấy tờ gì?"
5107,Công ty cổ phần thay đổi cổ đông sáng lập có phải thông báo với Sở Kế hoạch đầu tư hay không?
5108,"Chế độ, chính sách đối với giáo viên và cán bộ làm nhiệm vụ dạy văn hóa, giáo dục pháp luật, giáo dục công dân cho phạm nhân được quy định như thế nào?"
5109,Cơ sở kinh doanh dịch vụ viễn thông bao gồm những cơ sở nào?
5110,"Hồ sơ chuyển đổi Giấy phép thu, chi ngoại tệ và hoạt động ngoại hối khác (đối với doanh nghiệp kinh doanh trò chơi điện tử có thưởng) gồm những gì?"
5111,"HS, SV có trách nhiệm gì trong việc xây dựng môi trường giáo dục an toàn?"
5112,"Người được đề nghị công nhận là hòa giải viên phải đạt 100% đại diện hộ gia đình trong thôn, tổ dân phố đồng ý là đúng hay sai?"
5113,Vì sao phải cập nhật hồ sơ đăng ký thành viên mạng lưới hàng năm?
5114,Công ty đại chúng có phải nộp phí với UBCKNN hay không?
5115,Thể hiện không đúng hoặc không đầy đủ nội dung trong chứng từ xác nhận việc chấp nhận bưu gửi bị phạt bao nhiêu tiền?
5116,"Cha tôi là người phải thi hành án, đang bị bệnh nặng phải nằm viện, vậy có được hoãn thi hành án không?"
5117,Trợ cấp tạo việc làm cho binh sĩ xuất ngũ năm 2021 được tính như thế nào?
5118,"Điều khiển xe máy đăng ký tạm hoạt động quá phạm vi, thời hạn cho phép bị phạt bao nhiêu theo nghị định 100/2019/NĐ-CP?"
5119,Không có bảo hiểm xe máy bị phạt bao nhiêu tiền?
5120,"Hồ sơ xác nhận đăng ký khoản thu hồi nợ bảo lãnh cho người không cư trú của tổ chức tín dụng, chi nhánh ngân hàng nước ngoài theo quy định của NHNN bao gồm những gì?"
5121,"Trách nhiệm quản lý nhà nước của Bộ Văn hóa, Thể thao và Du lịch trong phòng chống tác hại của rượu, bia được quy định như thế nào?"
5122,"Chúng tôi hiện tại có 02 giấy phép sử dụng tần số và thiết bị vô tuyến điện thuộc nghiệp vụ di động hàng không. Nhưng đến nay chúng tôi muốn sử dụng thêm tần số off-set ±5 kHz so với tần số được cấp phép thì chúng tôi có cần phải sửa đổi, bổ sung giấy phép hay không?"
5123,"Chi cục Kiểm dịch động vật được thu phí, lệ phí thú y không?"
5124,Những công trình như thế nào thì do Cục Cảnh sát PCCC và CNCH thẩm duyệt?
5125,Trọng Tài thể thao thành tích cao gian lận khi điều hành thi đấu bị xử lý như thế nào?
5126,"Tôi đang phục vụ trong quân ngũ. Nay do có nhu cầu kết hôn, tôi cần Giấy xác nhận tôi còn độc thân. Vậy cơ quan nào có thẩm quyền cấp giấy này cho tôi?"
5127,"Điều khiển xe mô tô, xe gắn máy không có đèn báo hãm bị phạt bao nhiêu?"
5128,Thủ tướng Chính phủ được quyết định chủ trương chuyển mục đích sử dụng rừng sang mục đích khác như thế nào?
5129,Báo cáo tình hình thực hiện kết quả lựa chọn nhà thầu mua thuốc tập trung cấp địa phương được quy định như thế nào?
5130,"Trường hợp nào cơ quan, tổ chức Việt Nam được mang vũ khí quân dụng ra, vào Việt Nam?"
5131,Kê biên tài sản gắn liền với đất của pháp nhân thương mại như thế nào?
5132,Thủ tục thu hồi chứng chỉ hành nghề KCB trong quân đội được quy định như thế nào?
5133,"Khám bệnh vào ngày lễ, tết có được BHYT thanh toán không?"
5134,"Tôi muốn hỏi thời hạn nộp hồ sơ đăng ký thuế lần đầu đối với người nộp thuế là tổ chức kinh tế, tổ chức khác có hoạt động sản xuất kinh doanh"
5135,"Quy định về mức phạt tiền, thẩm quyền phạt tiền trong hoạt động thủy sản được quy định như thế nào?"
5136,Mức phạt khi lùi xe ô tô trong hầm đường bộ
5137,"Nội dung chi, mức chi hỗ trợ bồi dưỡng nguồn nhân lực phát triển hợp tác xã giai đoạn 2015- 2020 được quy định như thế nào?"
5138,Những trường hợp nào được miễn thủ tục xác minh về nhân thân khi xin thôi quốc tịch Việt Nam?
5139,"Đèn báo hiệu trên đường bộ, tại đường ngang là gì?"
5140,Thế nào là rà phá bom mìn vật nổ theo quy định pháp luật?
5141,"Tập huấn nghiệp vụ kiểm tra về phòng cháy, chữa cháy và cứu nạn, cứu hộ dành cho những đối tượng nào?"
5142,Hồ sơ cấp lại giấy phép hoạt động cho cơ sở KCB thuộc BQP được quy định như thế nào?
5143,Cơ sở lưu trú có được kinh doanh trong thời gian bị thu hồi giấy chứng nhận an ninh trật tự không?
5144,Hồ sơ đăng ký hạn mức nhận ủy thác tạm thời gồm những giấy tờ gì?
5145,Tự ý di chuyển vị trí biển báo “khu vực biên giới” bị phạt thế nào?
5146,"Giấy chứng nhận quyền sở hữu nhà ở, Giấy chứng nhận quyền sở hữu công trình xây dựng đã được cấp theo quy định tại Nghị định số 90/2006/NĐ-CP ngày 06 tháng 09 năm 2006 của Chính phủ Quy định chi tiết và hướng dẫn thi hành Luật Nhà ở có được coi là giấy tờ hợp pháp về đất đai để cấp giấy phép xây dựng không?"
5147,Thời hạn giải quyết tố cáo là bao nhiêu ngày?
5148,"Khi có nhu cầu xác nhận việc thực hiện nghĩa vụ nộp thuế đối với hàng hóa xuất khẩu, nhập khẩu, người nộp thuế gửi văn bản đề nghị xác nhận hoàn thành nghĩa vụ nộp thuế đến cơ quan nào?"
5149,"Việc phân loại, chuyển nội dung khiếu nại, tố cáo đến cơ quan, tổ chức, đơn vị, người có thẩm quyền thụ lý, giải quyết trong quá trình tiếp công dân được thực hiện như thế nào?"
5150,"Tôi đang bị đình chỉ hành nghề quản lý, thanh lý tài sản, khi nào thì tôi được hành nghề trở lại?"
5151,"Tôi muốn dự kiểm tra lấy chứng chỉ an toàn làm việc trên phương tiện đi ven biển, phương tiện chở xăng dầu, chở hoá chất, chở khí hoá lỏng thì điều kiện cần những gì?"
5152,"Thành phần, quy cách hồ sơ thiết kế BVTC, dự toán xây dựng quy định như thế nào?"
5153,Phạm vi thống kê ngành tư pháp được quy định như thế nào?
5154,Những trường hợp nào bị từ chối cấp Phiếu lý lịch tư pháp?
5155,Ngân hàng hợp tác xã thay đổi địa điểm đặt trụ sở chi nhánh (bao gồm cả trường hợp thay đổi địa điểm trước khi khai trương hoạt động) phải đáp ứng những điều kiện gì?
5156,"Khi nộp hồ sơ đề nghị cấp lại giấy phép bưu chính khi hết hạn, doanh nghiệp phải nộp báo cáo tài chính của 02 năm gần nhất. Vậy báo cáo tài chính 02 năm gần nhất là năm nào?"
5157,Chương trình khuyến nông là gì?
5158,"Thống kê, kiểm kê đất đai theo nhóm cộng đồng dân cư, cơ sở tôn giáo được quy định như thế nào?"
5159,Chứng thư số cấp cho tổ chức cung cấp dịch vụ chứng thực chữ ký số công cộng có hiệu lực trong vòng bao nhiêu lâu?
5160,Trong thời gian bao lâu chúng tôi được cấp Giấy phép chạy thử?
5161,Tổ chức phải đáp ứng những điều kiện nào để được cấp chứng chỉ năng lực lĩnh vực khảo sát xây dựng hạng I?
5162,Tôi muốn thực hiện thủ tục cấp giấy phép kinh doanh dịch vụ lữ hành quốc tế thì phải gửi hồ sơ đến đâu? Thời gian thực hiện thủ tục này được quy định như thế nào?
5163,"Việc xuất khẩu, nhập khẩu công cụ hỗ trợ thì thực hiện theo quy định gì?"
5164,Công ty chúng tôi có sản xuất các loại xe mô tô hai bánh phục vụ cho lực lượng an ninh thì có phải thực hiện chứng nhận chất lượng theo quy định tại Thông tư  số 45/2012/TT-BGTVT hay không?
5165,"Chúng tôi muốn được cấp Giấy phép kinh doanh VLNCN, điều kiện để được kinh doanh VLNCN là gì?"
5166,Xử lý vi phạm quy định về đánh dấu tàu cá được quy định như thế nào?
5167,Đề nghị cho biết các  thông tin cần đánh dấu mẫu vật đối với lâm sản và sản phẩm gỗ hoàn chỉnh được quy định như thế nào?
5168,Địa điểm làm thủ tục cho phương tiện thủy nội địa vào cảng biển ở đâu?
5169,Thẩm định dự toán xây dựng công trình gồm những nội dung gì?
5170,Chúng tôi là Công ty hoạt động trong lĩnh vực gia công giày dép xuất khẩu cho đối tác nước ngoài. Chúng tôi có thể bán sản phẩm giày dép gia công này cho doanh nghiệp Việt Nam được hay không để được thực hiện thủ tục hải quan?
5171,Mức phạt đối với hành vi điều khiển xe máy mà mang vác vật cồng kềnh ?
5172,"Thời gian huấn luyện về quản lý, sử dụng vũ khí, vật liệu nổ quân dụng, công cụ hỗ trợ được quy định như thế nào?"
5173,"Trình tự, thủ tục cấp đổi, cấp lại thẻ Căn cước công dân được quy định như thế nào?"
5174,"Khi tiến hành trình tự thủ tục chấp thuận những thay đổi danh sách dự kiến bầu, bổ nhiệm nhân sự của Qũy tín dụng nhân dân, Quỹ tín dụng nhân dân có cần phải hỏi ý kiến đại diện cấp ủy chính quyền địa phương về nhân sự dự kiến bầu, bổ nhiệm nhân sự trước khi gửi hồ sơ lên NHNN hay không?"
5175,"Công ty chúng tôi đã được cấp Giấy chứng nhận kiểm định cho lô phương tiện PCCC, tuy nhiên, khi đề nghị nghiệm thu công trình, đơn vị tư vấn giám sát yêu cầu cung cấp Biên bản kiểm định đã nêu làm căn cứ trong Giấy chứng nhận kiểm định đã được cấp. Chúng tôi mong nhận được hướng dẫn về vấn đề này."
5176,Tổ chức kinh tế ở nước ngoài là gì?
5177,Hành vi vi phạm hành chính trong hoạt động báo chí đã bị xử phạt chính là cảnh cáo thì có được tiếp tục phạt tiền nữa không?
5178,"Cơ quan tôi được trang bị súng bắn đạn cay, cao su, đề nghị cho biết hồ sơ cấp giấy phép sử dụng như thế nào?"
5179,"Doanh nghiệp đăng ký khai báo hóa chất trên cổng thông tin một cửa quốc gia, doanh nghiệp có phải nộp hồ sơ khai báo bản giấy lên cơ quan quản lý hay không?"
5180,Thủ tục thay đổi đăng ký giao dịch cổ phiếu trên Upcom được quy định như thế nào?
5181,Mức phạt khi chạy xe máy mà trong người có chất ma túy
5182,"Gà, vịt nếu đi lạc vào nhà ai thì của nhà người đó được quy định như thế nào?"
5183,Trình tự thực hiện thủ tục đăng ký thay đổi khoản cho vay ra nước ngoài  như thế nào
5184,"Những cơ quan, tổ chức nào được trang bị vũ khí quân dụng, cá nhân có được trang bị vũ khí quân dụng hay không?"
5185,Lãi suất đối với giấy tờ có giá được quy định như thế nào?
5186,Công ty làm HĐ mua xe và cho thuê lại nhằm cho vay với lãi cao có vi phạm?
5187,Xử phạt người điều khiển máy chuyên dùng vi phạm quy định về điều kiện của phương tiện khi tham gia giao thông theo nghị định 100/2019/NĐ-CP
5188,"Xây dựng tiêu chí, công nhận tổ chức, cá nhân thuộc mạng lưới tư vấn viên hỗ trợ doanh nghiệp nhỏ và vừa được quy định như thế nào?"
5189,"Khi cơ quan có thẩm quyền tiếp nhận hồ sơ đề nghị gia hạn Giấy phép khai thác khoáng sản, thời gian giải quyết là bao lâu ?"
5190,"Tôi muốn tra cứu thông tin về tài sản là động sản (không phải tàu bay, tàu biển), tôi có phải trả phí cho việc tìm hiểu thông tin không?"
5191,"Công ty chúng tôi đang có kế hoạch đầu tư thiết bị rada, chúng tôi không biết thủ tục đăng ký khai theo bản khai nào và cách tính phí như thế nào?"
5192,"Tổ chức, cá nhân khi mang vũ khí quân dụng vào, ra để luyện tập, thi đấu thể thao; triển lãm, trưng bày, chào hàng, giới thiệu sản phẩm; làm đạo cụ trong hoạt động văn hóa, nghệ thuật thì được mang số lượng, chủng loại gì, cơ quan nào có thẩm quyền quyết định?"
5193,"Việc xử lý tin báo về sự cố, tai nạn giao thông đường sắt đô thị được quy định như thế nào?"
5194,Phải có ý kiến của cơ quan nào khi lập các dự án đầu tư xây dựng công trình liên quan đến giao thông đường thuỷ nội địa?
5195,Tôi muốn hỏi thời hạn giải quyết hồ sơ hoàn trả tiền đã đóng đối với người tham gia bảo hiểm xã hội tự nguyện?
5196,Cơ quan có được đứng ra bảo lĩnh cho người trong đơn vị mình không?
5197,Trung tâm sát hạch lái xe thay đổi hình các bài sát hạch mà chưa được chấp thuận bị phạt bao nhiêu tiền?
5198,"Mức phạt khi không thực hiện các biện pháp phòng ngừa, ngăn chặn sự cố về an toàn thực phẩm được quy định như thế nào?"
5199,Các trường hợp phải được cắm mốc chỉ giới phạm vi bảo vệ công trình thủy lợi?
5200,Chủ sở hữu đường sắt chuyên dùng chịu trách nhiệm gì trong việc quản lý lối đi tự mở?
5201,Việc ứng dụng mô hình thông tin công trình trong quản lý dự án đầu tư xây dựng được quy định như thế nào?
5202,Trường hợp nào áp dụng tiêu chuẩn cơ sở trong hoạt động xây dựng?
5203,"Vào cuối năm nay, Công ty K sẽ tổ chức một sự kiện lớn. Tuy nhiên, theo dự báo, thời gian này trời khả năng có nhiều sương mù nên Công ty K muốn được thực hiện tác động vào thời tiết để làm giảm cường độ sương mù tại nơi tổ chức sự kiện. Trong trường hợp này, Công ty K có được phép thực hiện hay không? Nếu có, Công ty K cần phải thực hiện theo trình tự, thủ tục nào?"
5204,Thanh niên có những vai trò và nghĩa vụ gì?
5205,Người bị tố cáo có những nghĩa vụ gì?
5206,"Quy định về ứng xử giữa công chức, viên chức với cấp trên và đồng nghiệp ngành thanh tra và người làm công tác tiếp công dân"
5207,Trường hợp nào thì thương binh bị ngừng hưởng do khách quan hoặc bị thất lạc hồ sơ được cấp lại hồ sơ và giải quyết truy lĩnh trợ cấp thương tật?
5208,"Thủ tục khám chữa bệnh bảo hiểm y tế đối với người đang công tác, làm việc tại một vùng khác được quy định như thế nào?"
5209,Vật liệu xây dựng thân thiện với môi trường bao gồm những vật liệu nào?
5210,"Lập dự toán, phân bổ, chấp hành và quyết toán kinh phí hỗ trợ chi phí khám sức khỏe, điều trị nghiện bằng thuốc thay thế được quy định như thế nào?"
5211,Sau khi được trang bị vũ khí thô sơ thì làm thủ tục khai báo như thế nào?
5212,"Thành phần hồ sơ xin Cấp giấy chứng nhận kiểm dịch động vật, sản phẩm động vật thủy sản xuất khẩu không dùng làm thực phẩm có những loại giấy tờ nào?"
5213,"Hiệp hội của chúng tôi đã được cấp Giấy xác nhận đăng ký xét tặng giải thưởng chất lượng sản phẩm, hàng hóa cho tổ chức, cá nhân có thời hạn 03 năm. Tuy nhiên Giấy xác nhận sẽ hết hiệu lực trước khi kết thúc đợt tổ chức xét thưởng sắp tới. Vậy tổ chức có phải đăng ký lại hoạt động xét thưởng không?"
5214,Chế phẩm sinh học phải đăng ký lưu hành bao gồm những chế phẩm sinh học nào?
5215,Thời gian để Ngân hàng Nhà nước có quyết định sửa đổi địa chỉ đặt trụ sở của chi nhánh ngân hàng nước ngoài tại Giấy phép là bao lâu?
5216,"Trong trường hợp nào, khu du lịch bị thu hồi quyết định công nhận khu du lịch cấp tỉnh?"
5217,Đơn vị mua thuốc tập trung có trách nhiệm như thế nào?
5218,Không đưa thành viên gia đình là nạn nhân bạo lực gia đình đi cấp cứu bị xử lý ra sao?
5219,"Đối với thủ tục thông báo tổ chức triển lãm, trường hợp phải thành lập Hội đồng thẩm định thì thời hạn xử lý hồ sơ quuy định trong bao lâu?"
5220,Mức phạt khi nhân viên phục vụ xe khách cho hành khách xuống xe để trốn tránh sự kiểm tra là bao nhiêu?
5221,Dự án khuyến nông trung ương được phê duyệt ra sao?
5222,"Hồ sơ đề nghị sửa đổi nội dung giấy chứng nhận đăng ký cảng hàng không, sân bay gồm có những gì?"
5223,Nhiệm vụ quy hoạch phân khu xây dựng khu chức năng gồm các nội dung nào?
5224,Các ngành nghề cấm đầu tư và kinh doanh?
5225,"Mức phạt nếu tài xế xe khách không chạy đúng tuyến đường, lịch trình vận tải"
5226,Bán hàng kèm theo vé dự thưởng có phải thông báo cho cơ quan nhà nước không?
5227,Những nội dung đăng ký doanh nghiệp nào cần phải công bố công khai?
5228,"Thủ tục cấp giấy phép vận chuyển vũ khí thô sơ đối với cơ quan, tổ chức ở trung ương không thuộc phạm vi quản lý của Bộ Quốc phòng thực hiện như thế nào?"
5229,Ban quản lý dự án A đã giải thể nhưng chưa xử lý xong tài sản dự án thì cơ quan nào có trách nhiệm xử lý tài sản?
5230,Nghĩa vụ nộp phí quản lý công ty đại chúng của Công ty được tính như thế nào?
5231,"Giao nộp kết quả đề tài, dự án sản xuất thử nghiệm cấp Bộ Y tế được quy định như thế nào?"
5232,Đối tượng nào được sử dụng chứng thư số nước ngoài tại Việt Nam?
5233,Không đặt đèn đỏ vào ban đêm tại hai đầu đoạn đường bộ thi công bị phạt bao nhiêu theo nghị định 100/2019/NĐ-CP?
5234,Kế hoạch thực hiện quy hoạch năng lượng nguyên tử được quy định như thế nào?
5235,Đề nghị cho biết khiếu nại là gì?
5236,"Tổ chức phải đáp ứng những điều kiện nào để được cấp chứng chỉ năng lực lĩnh vực thiết kế xây dựng công trình hạng II, hạng III?"
5237,Câu lạc bộ thể thao trong nhà trường được quy định như thế nào?
5238,Thời hạn giải quyết Thủ tục thay đổi địa điểm đặt trụ sở chi nhánh của ngân hàng hợp tác xã là bao lâu?
5239,Việc trình báo đường thủy nội địa có giá trị pháp lý như thế nào?
5240,"Tôi ký hợp đồng lao động với nhiều chủ sử dụng lao động, đang đóng bảo hiểm thất nghiệp theo hợp đồng lao động đầu tiên, tôi muốn hỏi ngoài tiền lương theo công việc tôi được hưởng theo các hợp đồng lao động còn lại, tôi còn được người sử dụng lao động của các hợp đồng lao động còn lại này chi trả thêm khoản bảo hiểm nào không?"
5241,Yêu cầu đối với nhân viên kỹ thuật như thế nào để được cấp thẻ kiểm định viên?
5242,"Trường hợp nào không thuộc trường hợp điều chỉnh giấy phép khai thác nước mặt, nước biển?"
5243,Phụ cấp nhân viên y tế học đường được quy định như thế nào?
5244,"Cơ quan tôi thuộc đối tượng được phép trang bị vũ khí thể thao, cho tôi hỏi hồ sơ đề nghị được trang bị vũ khí thể thao như thế nào?"
5245,Nghiên cứu y sinh học đa trung tâm là gì?
5246,"Những nội dung gì không được hợp pháp hóa lãnh sự, chứng nhận lãnh sự?"
5247,Trách nhiệm của Phòng Giáo dục và Đào tạo về việc lựa chọn SGK được quy định như thế nào?
5248,Thiết kế đô thị được lập trong các trường hợp nào?
5249,"Doanh nghiệp tôi nhập khẩu muối thực phẩm về để chế biến thực phẩm nội bộ của doanh nghiệp, không nhập khẩu muối với mục đích thương mại, Doanh nghiệp tôi có phải thực hiện kiểm tra an toàn muối thực phẩm không?"
5250,Viên chức công nghệ thông tin hạng IV gồm những chức danh nào?
5251,Doanh nghiệp chúng tôi là chủ đầu tư và dự kiến nhập khẩu 01 phương tiện vận tải chuyên dùng để phục vụ cho hoạt động sản xuất của dự án làm cơ sở để được hưởng ưu đãi thuế nhập khẩu theo quy định của pháp luật.Cho hỏi thủ tục hồ sơ để xác định phương tiện vận tải chuyên dùng trong dây chuyền công nghệ được thực hiện theo quy định nào và có được thực hiện trước khi nhập khẩu phương tiện đó về Việt Nam hay không?
5252,Mức phạt nếu nhân viên xe du lịch bắt ép hành khách sử dụng dịch vụ ngoài ý muốn là bao nhiêu?
5253,Thoát nước mưa qua nhà người khác có được không?
5254,"Trường hợp tôi muốn hạ thủy phương tiện vừa được sửa chữa, đóng mới để chạy thử, tôi có cần thực hiện thủ tục cho phương tiện rời cảng, bến thủy nội địa không?"
